{
  "_generated": "generated by running reference implementation(s) as sealed programs on this board with the 'default' profile settings and measuring the resulting Layout under the spec's connectivity and DRC rules; median of the runs listed in notes where a run took under 10 s",
  "board": "Issue230-CNH_Functional_Tester-CNH_Functional_Tester_1.dsn",
  "boardSha256": "794d7465cc42a4baac43bd54a28118bc2265dcb6ace48e6296ca80735322a67d",
  "profile": "default",
  "settings": {
    "maxPasses": 100,
    "timeoutSeconds": 60,
    "optimizer": true,
    "fanout": false
  },
  "refA": {
    "connections": 203,
    "incompleteBefore": 144,
    "incompleteAfter": 2,
    "vias": 4,
    "traceLengthMm": 574.684,
    "violationsBefore": 16,
    "violationsAfter": 16,
    "passes": 13,
    "wallClockMs": 60632,
    "tracks": 225,
    "status": "timeout",
    "host": "reference A"
  },
  "refB": {
    "connections": 203,
    "incompleteBefore": 144,
    "incompleteAfter": 25,
    "vias": 58,
    "traceLengthMm": 512.918,
    "violationsBefore": 16,
    "violationsAfter": 16,
    "passes": 2,
    "wallClockMs": 62473,
    "tracks": 311,
    "status": "timeout",
    "host": "reference B"
  },
  "notes": "reference A: 1 run(s). reference A's own counts are incomplete 149 before / 7 after; the recorded values are recomputed on its Layout under the spec's connectivity rules K-01..K-03 (the pour ruling: same-net copper that overlaps is connected, only groups holding a Pad or Pour count) and DR-02 (same-net pairs are never spacing violations), see rules/connectivity.md and rules/drc.md. reference B: 1 run(s). reference B's own counts are incomplete 145 before / 25 after; the recorded values are recomputed on its Layout under the spec's connectivity rules K-01..K-03 (the pour ruling: same-net copper that overlaps is connected, only groups holding a Pad or Pour count) and DR-02 (same-net pairs are never spacing violations), see rules/connectivity.md and rules/drc.md. reference A ran single-threaded with its fanout pre-pass disabled for this profile unless the profile enables it, its copper-to-edge and hole clearance overrides unset (the file's own rules apply), and any settings block in the file honoured; reference B ran with rip-up and in-search shoving enabled and its optimiser on, ignoring any settings block in the file."
}
