{
  "_generated": "generated by running baseline router(s) as sealed programs on this board with the 'novia' profile settings and measuring the resulting Layout under the spec's connectivity and DRC rules; median of the runs listed in notes where a run took under 10 s",
  "board": "Issue433-my-board.dsn",
  "boardSha256": "36ce022caadc2e375e7faa5ecd0325f45671df6a1cbe71c13e3f10bed7086b50",
  "profile": "novia",
  "settings": {
    "maxPasses": 100,
    "timeoutSeconds": 60,
    "optimizer": true,
    "fanout": false,
    "viasAllowed": false
  },
  "refA": {
    "connections": 9,
    "incompleteBefore": 9,
    "incompleteAfter": 0,
    "vias": 0,
    "traceLengthMm": 154.04,
    "violationsBefore": 0,
    "violationsAfter": 0,
    "passes": 4,
    "wallClockMs": 770,
    "tracks": 18,
    "status": "ok",
    "host": "reference A"
  },
  "refB": {
    "connections": 9,
    "incompleteBefore": 9,
    "incompleteAfter": 2,
    "vias": 0,
    "traceLengthMm": 165.47,
    "violationsBefore": 0,
    "violationsAfter": 0,
    "passes": 6,
    "wallClockMs": 1917,
    "tracks": 17,
    "status": "ok",
    "host": "reference B"
  },
  "notes": "reference A: 3 run(s). reference B: 3 run(s). reference A ran single-threaded with its fanout pre-pass disabled for this profile unless the profile enables it, its copper-to-edge and hole clearance overrides unset (the file's own rules apply), and any settings block in the file honoured; reference B ran with rip-up and in-search shoving enabled and its optimiser on, ignoring any settings block in the file. Correction (Q-I2-58): traceLengthMm on this board is expressed in true millimetres; the value was multiplied by ten because this board's resolution units are one ten-thousandth of a millimetre and the earlier figure was one tenth of the true routed length."
}
