{
  "_generated": "generated by running reference implementation(s) as sealed programs on this board with the 'default' profile settings and measuring the resulting Layout under the spec's connectivity and DRC rules; median of the runs listed in notes where a run took under 10 s",
  "board": "Issue110-Pajalnaja_stancija.dsn",
  "boardSha256": "46e0bf62c0872e93b7cbe5a89ad5591de192035014eeaed28cb54c42a187c0ca",
  "profile": "default",
  "settings": {
    "maxPasses": 100,
    "timeoutSeconds": 60,
    "optimizer": true,
    "fanout": false
  },
  "refA": {
    "connections": 109,
    "incompleteBefore": 109,
    "incompleteAfter": 6,
    "vias": 10,
    "traceLengthMm": 267.8,
    "violationsBefore": 10,
    "violationsAfter": 10,
    "passes": 7,
    "wallClockMs": 60334,
    "tracks": 207,
    "status": "timeout",
    "host": "reference A"
  },
  "refB": {
    "connections": 109,
    "incompleteBefore": 109,
    "incompleteAfter": 7,
    "vias": 54,
    "traceLengthMm": 300.324,
    "violationsBefore": 10,
    "violationsAfter": 10,
    "passes": 3,
    "wallClockMs": 64430,
    "tracks": 332,
    "status": "timeout",
    "host": "reference B"
  },
  "notes": "reference A: 1 run(s). reference B: 1 run(s). reference A ran single-threaded with its fanout pre-pass disabled for this profile unless the profile enables it, its copper-to-edge and hole clearance overrides unset (the file's own rules apply), and any settings block in the file honoured; reference B ran with rip-up and in-search shoving enabled and its optimiser on, ignoring any settings block in the file."
}
