{
  "_generated": "generated by running baseline router(s) as sealed programs on this board with the 'novia' profile settings and measuring the resulting Layout under the spec's connectivity and DRC rules; median of the runs listed in notes where a run took under 10 s",
  "board": "empty_board.dsn",
  "boardSha256": "074212672893271f00ec9ef64f5002c66fa6336b1d32a82d9e6bc487b07ddc12",
  "profile": "novia",
  "settings": {
    "maxPasses": 100,
    "timeoutSeconds": 60,
    "optimizer": true,
    "fanout": false,
    "viasAllowed": false
  },
  "refA": {
    "connections": 0,
    "incompleteBefore": 0,
    "incompleteAfter": 0,
    "vias": 0,
    "traceLengthMm": 0,
    "violationsBefore": 0,
    "violationsAfter": 0,
    "passes": 1,
    "wallClockMs": 54,
    "tracks": 0,
    "status": "ok",
    "host": "reference A"
  },
  "refB": {
    "connections": 0,
    "incompleteBefore": 0,
    "incompleteAfter": 0,
    "vias": 0,
    "traceLengthMm": 0,
    "violationsBefore": 0,
    "violationsAfter": 0,
    "passes": 1,
    "wallClockMs": 2,
    "tracks": 0,
    "status": "ok",
    "host": "reference B"
  },
  "notes": "reference A: 3 run(s). reference B: 3 run(s). reference A ran single-threaded with its fanout pre-pass disabled for this profile unless the profile enables it, its copper-to-edge and hole clearance overrides unset (the file's own rules apply), and any settings block in the file honoured; reference B ran with rip-up and in-search shoving enabled and its optimiser on, ignoring any settings block in the file."
}
