{
  "_generated": "generated by running reference implementation(s) as sealed programs on this board with the 'novia' profile settings and measuring the resulting Layout under the spec's connectivity and DRC rules; median of the runs listed in notes where a run took under 10 s",
  "board": "Issue110-RelayModule.dsn",
  "boardSha256": "ccb9f1038e5140a29ae3698d33803939dfb8f56093213bf70c63825aa3a5fcf6",
  "profile": "novia",
  "settings": {
    "maxPasses": 100,
    "timeoutSeconds": 60,
    "optimizer": true,
    "fanout": false,
    "viasAllowed": false
  },
  "refA": {
    "connections": 88,
    "incompleteBefore": 88,
    "incompleteAfter": 4,
    "vias": 22,
    "traceLengthMm": 1294.51,
    "violationsBefore": 4,
    "violationsAfter": 4,
    "passes": 1,
    "wallClockMs": 26862,
    "tracks": 159,
    "status": "ok",
    "host": "reference A"
  },
  "refB": {
    "connections": 88,
    "incompleteBefore": 88,
    "incompleteAfter": 12,
    "vias": 22,
    "traceLengthMm": 1079.69,
    "violationsBefore": 4,
    "violationsAfter": 4,
    "passes": 6,
    "wallClockMs": 60248,
    "tracks": 170,
    "status": "timeout",
    "host": "reference B"
  },
  "notes": "reference A: 1 run(s). reference B: 1 run(s). reference B's own counts are incomplete 88 before / 13 after; the recorded values are recomputed on its Layout under the spec's connectivity rules K-01..K-03 (the pour ruling: same-net copper that overlaps is connected, only groups holding a Pad or Pour count) and DR-02 (same-net pairs are never spacing violations), see rules/connectivity.md and rules/drc.md. reference A ran single-threaded with its fanout pre-pass disabled for this profile unless the profile enables it, its copper-to-edge and hole clearance overrides unset (the file's own rules apply), and any settings block in the file honoured; reference B ran with rip-up and in-search shoving enabled and its optimiser on, ignoring any settings block in the file. Correction (Q-I2-58): traceLengthMm on this board is expressed in true millimetres; the value was multiplied by ten because this board's resolution units are one ten-thousandth of a millimetre and the earlier figure was one tenth of the true routed length."
}
