{
  "_generated": "generated by running reference implementation(s) as sealed programs on this board with the 'applied-ses' profile settings and measuring the resulting Layout under the spec's connectivity and DRC rules; median of the runs listed in notes where a run took under 10 s",
  "board": "Issue368-CorneyIslandWireless_input_design.dsn",
  "boardSha256": "287b6952a909879045c9523e0fee4ab3d581a23002450b0a44abd00d169d50b3",
  "profile": "applied-ses",
  "settings": {
    "router": false,
    "optimizer": false,
    "ses": "Issue368-CorneyIslandWireless_output_session.ses"
  },
  "refA": {
    "connections": 3,
    "incompleteBefore": 3,
    "incompleteAfter": 0,
    "vias": 0,
    "traceLengthMm": 25.68,
    "violationsBefore": 0,
    "violationsAfter": 0,
    "passes": 0,
    "wallClockMs": 486,
    "tracks": 7,
    "status": "ok",
    "host": "reference A"
  },
  "refB": {
    "connections": 3,
    "incompleteBefore": 3,
    "incompleteAfter": 0,
    "vias": 0,
    "traceLengthMm": 25.68,
    "violationsBefore": 0,
    "violationsAfter": 0,
    "passes": 0,
    "wallClockMs": 33,
    "tracks": 7,
    "status": "ok",
    "host": "reference B"
  },
  "notes": "reference A: 1 run(s); file wiring removed before applying the session (0 Tracks, 0 Barrels not locked), per ses.md F-S61. session import: 7 wires, 0 vias, 0 errors. reference B: 1 run(s); file wiring removed before applying the session (0 Tracks, 0 Barrels not locked), per ses.md F-S61. session import: 7 wires, 0 vias, 0 errors. reference A ran single-threaded with its fanout pre-pass disabled for this profile unless the profile enables it, its copper-to-edge and hole clearance overrides unset (the file's own rules apply), and any settings block in the file honoured; reference B ran with rip-up and in-search shoving enabled and its optimiser on, ignoring any settings block in the file. Correction (Q-I2-58): traceLengthMm on this board is expressed in true millimetres; the value was multiplied by ten because this board's resolution units are one ten-thousandth of a millimetre and the earlier figure was one tenth of the true routed length."
}
