{
  "_generated": "generated by running baseline router(s) as sealed programs on this board with the 'default' profile settings and measuring the resulting Layout under the spec's connectivity and DRC rules; median of the runs listed in notes where a run took under 10 s",
  "board": "Issue006-LPC18XX_43XX_SCH.dsn",
  "boardSha256": "b3f7e85697f3bf62624447f4bb6dfe5b633bf83d49d5288936bdcd8ef20220ad",
  "profile": "default",
  "settings": {
    "maxPasses": 100,
    "timeoutSeconds": 60,
    "optimizer": true,
    "fanout": false
  },
  "refA": {
    "status": "error",
    "host": "reference A"
  },
  "refB": {
    "status": "error",
    "host": "reference B"
  },
  "notes": "reference A: 1 run(s); could not read the board (parse error). reference B: 1 run(s); could not read the board (not a DSN file). reference A ran single-threaded with its fanout pre-pass disabled for this profile unless the profile enables it, its copper-to-edge and hole clearance overrides unset (the file's own rules apply), and any settings block in the file honoured; reference B ran with rip-up and in-search shoving enabled and its optimiser on, ignoring any settings block in the file."
}
