{
  "_generated": "generated by running reference implementation(s) as sealed programs on this board with the 'novia' profile settings and measuring the resulting Layout under the spec's connectivity and DRC rules; median of the runs listed in notes where a run took under 10 s",
  "board": "Issue508-DAC2020_bm05.dsn",
  "boardSha256": "9378e9d022e28b72b31ad3725f1362e265f10d0c5b6bc36cfd0f6fda37213282",
  "profile": "novia",
  "settings": {
    "maxPasses": 100,
    "timeoutSeconds": 60,
    "optimizer": true,
    "fanout": false,
    "viasAllowed": false
  },
  "refA": {
    "connections": 107,
    "incompleteBefore": 107,
    "incompleteAfter": 51,
    "vias": 0,
    "traceLengthMm": 30.546,
    "violationsBefore": 0,
    "violationsAfter": 0,
    "passes": 1,
    "wallClockMs": 33892,
    "tracks": 108,
    "status": "ok",
    "host": "reference A"
  },
  "refB": {
    "connections": 107,
    "incompleteBefore": 107,
    "incompleteAfter": 39,
    "vias": 0,
    "traceLengthMm": 59.981,
    "violationsBefore": 0,
    "violationsAfter": 0,
    "passes": 8,
    "wallClockMs": 60012,
    "tracks": 159,
    "status": "timeout",
    "host": "reference B"
  },
  "notes": "This file is byte-identical to Issue508-DAC2020-DAC2020_bm05-DAC2020_bm05.unrouted.dsn; the numbers were measured on that copy. reference A: 1 run(s). reference B: 1 run(s). reference A ran single-threaded with its fanout pre-pass disabled for this profile unless the profile enables it, its copper-to-edge and hole clearance overrides unset (the file's own rules apply), and any settings block in the file honoured; reference B ran with rip-up and in-search shoving enabled and its optimiser on, ignoring any settings block in the file."
}
